{
  "schema_version": 1,
  "default_decision": "deny",
  "actions": {
    "read": "allow",
    "write": "allow",
    "run-tests": "allow",
    "open-issue": "review-required",
    "open-pr": "review-required",
    "create-followup": "review-required"
  },
  "protected_boundaries": [
    {
      "id": "workflow-and-permissions",
      "decision": "review-required",
      "minimum_risk_tier": "high",
      "paths": [
        ".github/workflows/**",
        ".github/skills-sync.json",
        "scripts/apply-repo-settings.sh",
        "scripts/rollout-merge-queue.sh",
        "scripts/sync-skills.sh"
      ],
      "detectors": []
    },
    {
      "id": "deployment-and-infrastructure",
      "decision": "review-required",
      "minimum_risk_tier": "high",
      "paths": [
        "organization/**"
      ],
      "detectors": []
    },
    {
      "id": "supply-chain-provenance",
      "decision": "review-required",
      "minimum_risk_tier": "high",
      "paths": [
        ".agents/skills/**",
        "templates/**"
      ],
      "detectors": []
    },
    {
      "id": "quality-gates",
      "decision": "review-required",
      "minimum_risk_tier": "high",
      "paths": [
        "scripts/check-docs.mjs",
        "scripts/check-organization.mjs",
        "scripts/lib/**",
        "test/**"
      ],
      "detectors": []
    }
  ],
  "change_controls": {
    "pull_requests_required": true,
    "human_review_before_merge": true,
    "highest_applicable_risk": true,
    "validation_evidence_required": true,
    "least_privilege": true,
    "untrusted_content_is_data": true,
    "never_relax": [
      "required-checks",
      "security-checks",
      "review-requirements",
      "coverage-checks",
      "provenance-verification"
    ]
  },
  "exception_controls": {
    "independent_authorized_approver": true,
    "self_approval": false,
    "required_fields": [
      "rationale",
      "target",
      "compensating-controls",
      "expires-at",
      "restoration-or-closure-plan"
    ]
  },
  "risk_classification": {
    "tiers": [
      "low",
      "moderate",
      "high",
      "critical"
    ],
    "classification_rule": "highest-applicable",
    "uncertainty_rule": "higher-plausible"
  }
}
